{
 "$schema": "http://json-schema.org/draft-07/schema#",
 "title": "Category",
 "type": "object",
 "required": [
  "id",
  "name",
  "blurb",
  "color",
  "glyph"
 ],
 "properties": {
  "id": {
   "type": "string"
  },
  "name": {
   "type": "string"
  },
  "blurb": {
   "type": "string"
  },
  "color": {
   "type": "string"
  },
  "glyph": {
   "type": "string"
  }
 }
}