[
  {
    "blurb": "Activities that ride the turning year. Fall leaves, winter making, spring planting, summer play.",
    "color": "#c77b1e",
    "glyph": "\ud83c\udf42",
    "id": "seasons",
    "name": "Seasons"
  },
  {
    "blurb": "Festive projects and games for the days the whole group looks forward to.",
    "color": "#b7413c",
    "glyph": "\ud83c\udf89",
    "id": "holidays",
    "name": "Holidays"
  },
  {
    "blurb": "Hands-on making: fold it, paint it, build it, take it home.",
    "color": "#7b5fc7",
    "glyph": "\u2702\ufe0f",
    "id": "crafts",
    "name": "Crafts"
  },
  {
    "blurb": "Experiments, engineering challenges, and satisfying science demos.",
    "color": "#0d8a96",
    "glyph": "\ud83d\udd2c",
    "id": "stem",
    "name": "STEM"
  },
  {
    "blurb": "Run, jump, dance. Activities that burn off the wiggles.",
    "color": "#2e9e5b",
    "glyph": "\u26bd",
    "id": "pe-movement",
    "name": "PE & Movement"
  },
  {
    "blurb": "Turn a group into a crew: cooperation, trust, and belonging.",
    "color": "#c98f1b",
    "glyph": "\ud83e\udd1d",
    "id": "team-community",
    "name": "Team & Community"
  },
  {
    "blurb": "First-day friendly: learn names, laugh, and loosen up fast.",
    "color": "#d4567e",
    "glyph": "\ud83d\udc4b",
    "id": "icebreakers",
    "name": "Icebreakers"
  },
  {
    "blurb": "Fresh-air activities for fields, playgrounds, and nature walks.",
    "color": "#4f7d3a",
    "glyph": "\ud83c\udf33",
    "id": "outdoor",
    "name": "Outdoor"
  },
  {
    "blurb": "Stuck inside? These keep a roomful of kids happy without a gym.",
    "color": "#4a7ec2",
    "glyph": "\ud83c\udf27\ufe0f",
    "id": "rainy-day",
    "name": "Rainy Day"
  },
  {
    "blurb": "Wind-down worthy: calm, creative, individual or small-group.",
    "color": "#6b7280",
    "glyph": "\ud83e\uddd8",
    "id": "quiet-focus",
    "name": "Quiet & Focus"
  },
  {
    "id": "music-rhythm",
    "name": "Music & Rhythm",
    "glyph": "\ud83e\udd41",
    "color": "#a855f7",
    "blurb": "Drums, shakers, rhythm games, and songs. Make some noise."
  }
]